{
  "schemaVersion": "1.0.0",
  "documentType": "synthetic_workspace_manifest",
  "workflowVersion": "scenario-first-1.0.0",
  "success": true,
  "scenarioId": "mario_rossi_autonomous_elderly_2026_10_30",
  "bundleId": "mario_rossi_autonomous_elderly_2026_10_30__synthetic_mario_rome_apartment_logical_v1__behavior_1.1.0__1.0.0",
  "traceId": "trace_bf15142282e5bd61",
  "sensorLogId": "sensor_log_f8e94b9bb0dfcb80",
  "artifacts": [
    {
      "role": "scenario",
      "relativePath": "scenario.json",
      "sha256": "31d339adb481a7967cb221c8c4dc7233e7ae8d03f277802ac9ccaf6913581eac"
    },
    {
      "role": "behavior_package",
      "relativePath": "personal-process-package.json",
      "sha256": "f5b431eafe1c135157f9a0419e7725984ffb788153e221037af5adf3f5832222"
    },
    {
      "role": "home_policy",
      "relativePath": "home-generation-policy.json",
      "sha256": "ae249dc391f53476337107adf69bf2826910f8a50bf78f5f55947cef4379ad5a"
    },
    {
      "role": "home_report",
      "relativePath": "home-generation-report.json",
      "sha256": "b29f203361538ebb39166acfaf38b462848fd23f9b4ea5f394100eebf66f0333"
    },
    {
      "role": "home",
      "relativePath": "home-model.json",
      "sha256": "504c07f6e99465a16c665b7ad6efab140d30c44d38bf46d6c7733378e2ba3717"
    },
    {
      "role": "compilation_report",
      "relativePath": "compilation-report.json",
      "sha256": "4fd0222f962deaffde61dcb8b73373c10315970a2e5a7c5b5a3546762c5fc46f"
    },
    {
      "role": "canonical_plan",
      "relativePath": "canonical-plan.json",
      "sha256": "5b334b9dad40501afb1cdbf11661b8f38fe5599d028802fd035453be10de7c5b"
    },
    {
      "role": "environment_report",
      "relativePath": "environment-report.json",
      "sha256": "b1f48d7eacfbbdda88aa57194b70c647c9469066064b6567ee144ff2b61f3fdd"
    },
    {
      "role": "simulation_bundle",
      "relativePath": "simulation-bundle.json",
      "sha256": "bf15142282e5bd616d1e7e112cf08c63b0a91825e9f5a85cac2d33e403e3e10f"
    },
    {
      "role": "sensor_policy",
      "relativePath": "sensor-deployment-policy.json",
      "sha256": "b4195a60879b83a2bfea915c0f29d8d048ae3066f15ac01c8cf75b2f7158d75d"
    },
    {
      "role": "sensor_report",
      "relativePath": "sensor-deployment-report.json",
      "sha256": "aa60dfce329aee2ef2308c26857fec9ed619188a0efc370d20fd63387fa22b71"
    },
    {
      "role": "sensor_model",
      "relativePath": "sensor-model.json",
      "sha256": "e6b9bad8b46bff268a0f43456c0dd0dda07b807666fcf728a7b27a79434012bd"
    },
    {
      "role": "plan_approval",
      "relativePath": "plan-approval.json",
      "sha256": "d9606845ae101b54f4d3387508e2d902811c2f1afe1fdfcb9ace56c96c2145db"
    },
    {
      "role": "simulation_report",
      "relativePath": "simulation-report.json",
      "sha256": "5c84ff052e1fc3dd5cd5042260ac65af51a943aeb071ccf5979d82aaf0269401"
    },
    {
      "role": "execution_trace",
      "relativePath": "execution-trace.json",
      "sha256": "6ac8fe62491dc917f5bf770d9106c41d9faaac3a6e9f4a00465efa702cdf4a58"
    },
    {
      "role": "projection_report",
      "relativePath": "sensor-projection-report.json",
      "sha256": "d77a0b5feb32346826fb8b812d0f2d1a37ee2a8d058cfba5836e43e69d45c444"
    },
    {
      "role": "observable_sensor_log",
      "relativePath": "observable-sensor-log.json",
      "sha256": "27a48027c4415a2916ed38546bbea0e515be9348473a66518febcd11a704b929"
    },
    {
      "role": "oracle_mapping",
      "relativePath": "oracle-mapping.json",
      "sha256": "f35deb0cf8ba2895bbf33f5d877892f093274ff1af2b0b539f0cb5d4118dc236"
    }
  ]
}
